,Movie Name,Audience Score,AUDIENCE SCORE reviews,Tomatometer Score,TOMATOMETER reviews,Genre,Original Language,Director,Producer,Writer,Release Date (Theaters),Release Date (Streaming),box office,Runtime,Distributor,MOVIE INFO
0,IT'S CHRISTMAS AGAIN,--,Fewer than 50 Ratings,--,IT'S CHRISTMAS AGAIN,"Kids & Family, Holiday, Romance, Drama, Musical",English,Sandra L. Martin,,Sandra L. Martin,"Nov 29, 2022  Limited",,,1h 45m,Fathom Events,"Jake Young (Lawson Touliatos) wants nothing more than to spend his Christmas vacation with his girlfriend, Abbey Walker (Leela Owen). So when Abbey volunteers for her church's Christmas play, Jake is ready to skip Christmas this year until an unexpected turn of events lands him in a field outside Bethlehem on the night Jesus was born. While on his journey with the shepherds to find the promised Messiah, Jake discovers the true meaning of Christmas. Coming this Christmas season, IT'S CHRISTMAS AGAIN is a modern-day musical the whole family will love!"
1,EVANGELION:3.0+1.01 THRICE UPON A TIME,--,500+ Ratings,100%,EVANGELION:3.0+1.01 THRICE UPON A TIME,"Sci-Fi, Action, Anime, Drama",Japanese,"Hideaki Anno, Mahiro Maeda, Katsuichi Nakayama, Kazuya Tsurumaki",,Hideaki Anno,"Nov 30, 2022  Limited","Aug 13, 2021",,2h 34m,GKIDS / Fathom Events,"From legendary director Hideaki Anno, EVANGELION:3.0+1.01 THRICE UPON A TIME is the fourth and final installment of the REBUILD OF EVANGELION films, bringing an epic conclusion to the story of Shinji and his fellow Eva pilots, with the stunning visuals and thought-provoking storytelling that has made EVANGELION a global pop culture phenomenon. Misato and her anti-NERV group Wille arrive at Paris, a city now red from core-ization. Crew from the flagship Wunder land on a containment tower. They only have 720 seconds to restore the city. When a horde of NERV Evas appear, Mari's improved Eva Unit 8 must intercept. Meanwhile, Shinji, Asuka, and Rei (Provisional Name) wander about Japan."
2,NCT DREAM THE MOVIE: IN A DREAM,97%,Fewer than 50 Verified Ratings,--,NCT DREAM THE MOVIE: IN A DREAM,"Documentary, Music",,Oh Yoon Dong,,,"Nov 30, 2022  Limited",,,1h 57m,Trafalgar Releasing,South Korean pop group NCT Dream performs two concerts over two sold-out nights.
3,PORTRAIT OF THE QUEEN,--,Fewer than 50 Ratings,--,PORTRAIT OF THE QUEEN,"Documentary, Biography",English,Unknown Director,,,"Nov 30, 2022  Limited",,,1h 40m,Fathom Events,"Queen Elizabeth II was the most photographed, the most loved and talked about, spied upon, praised, criticized, popular woman on the planet. All over the globe and in every moment of her long life, that came to an end at the age of 96, people have always wanted to watch her through a peephole, discover new things about her, get to know her better, connect with her and understand her. Portrait of the Queen offers an original portrayal of the story of The Queen from a totally new perspective: through the most intense, amazing, revealing photographic portraits of her, as shared by the extraordinary photographers who accompanied and often created the image of the British monarchy itself. Special focus is given to each of The Queen's most intense, intimate, faithful portraits, symbols of 20th century history, contextualized by the photographers who portrayed Her Majesty -- Brian Aris, Jason Bell, Julian Calder, Chris Levine, David Montgomery, and John Swannell."
4,THE HARBINGER,--,0 Ratings,96%,THE HARBINGER,"Horror, Mystery & Thriller, Drama",English,Andy Mitton,"Jay Dunn, Richard W. King, Andy Mitton, Clark Freeman",Andy Mitton,"Dec 1, 2022  Limited","Dec 1, 2022",,1h 26m,XYZ Films,"Plagued by horrific nightmares, a woman enters a hellish dreamscape to confront her greatest fears."
5,NEIL YOUNG: HARVEST TIME,86%,Fewer than 50 Ratings,100%,NEIL YOUNG: HARVEST TIME,"Documentary, Music",English,Neil Young,Gary Ward,,"Dec 1, 2022  Limited",,,2h 5m,Trafalgar Releasing,"Created between January and September 1971, this docu-film takes us on an intimate journey to Young’s farm in Northern California for the 'Harvest Barn' sessions, to London for an iconic performance with the London Symphony Orchestra and to Nashville where the then 20 something Neil Young worked on various tracks of this signature album. The feature is a fan piece that has never been seen before. Performance and rehearsal content is intertwined into creative storytelling and includes most of the tracks from album Harvest (released in 1972) including ""Heart of Gold"", ""A Man Needs A Maid"", ""Alabama"" and ""Old Man""."
6,I HEARD THE BELLS,98%,250+ Ratings,--,I HEARD THE BELLS,"Drama, Holiday",English,Joshua Enck,Joshua Enck,"Joshua Enck, Jeff Bender","Dec 1, 2022  Limited",,,1h 50m,Fathom Events,"I HEARD THE BELLS tells the inspiring true story behind the beloved Christmas carol and its author, Henry Wadsworth Longfellow. Known as America's Poet, Henry leads an idyllic life -- until the day his world is shattered by tragedy. With a nation divided by Civil War and his family torn apart, Henry puts down his pen, silenced by grief. But it's the sound of Christmas morning that reignites the poet's lost voice as he discovers the resounding hope of rekindled faith."
7,VIOLENT NIGHT,88%,500+ Verified Ratings,70%,VIOLENT NIGHT,"Holiday, Action, Comedy",English,Tommy Wirkola,"Kelly McCormick, David Leitch, Guy Danella","Pat Casey, Worm Miller","Dec 2, 2022  Wide",,,1h 41m,Universal Pictures,"When a team of mercenaries breaks into a wealthy family compound on Christmas Eve, taking everyone inside hostage, the team isn't prepared for a surprise combatant: Santa Claus (David Harbour, Black Widow, Stranger Things series) is on the grounds, and he's about to show why this Nick is no saint."
8,EMANCIPATION,100%,Fewer than 50 Verified Ratings,50%,EMANCIPATION,"History, Drama, Mystery & Thriller",English,Antoine Fuqua,"Will Smith, Jon Mone, Joey McFarland, Todd Black",Bill Collage,"Dec 2, 2022  Limited","Dec 9, 2022",,2h 12m,Apple TV+,"""Emancipation"" tells the triumphant story of Peter (Will Smith), a man who escapes from slavery, relying on his wits, unwavering faith and deep love for his family to evade cold-blooded hunters and the unforgiving swamps of Louisiana on his quest for freedom. The film is inspired by the 1863 photos of ""Whipped Peter,"" taken during a Union Army medical examination, that first appeared in Harper's Weekly. One image, known as ""The Scourged Back,"" which shows Peter’s bare back mutilated by a whipping delivered by his enslavers, ultimately contributed to growing public opposition to slavery."
9,THE ETERNAL DAUGHTER,71%,Fewer than 50 Ratings,96%,THE ETERNAL DAUGHTER,"Mystery & Thriller, Drama",English,Joanna Hogg,"Ed Guiney, Andrew Lowe, Emma Norton, Joanna Hogg",Joanna Hogg,"Dec 2, 2022  Limited","Dec 2, 2022",,1h 36m,A24,"An artist and her elderly mother confront long-buried secrets when they return to a former family home, now a hotel haunted by its mysterious past. Featuring a towering, deeply moving performance by Tilda Swinton, acclaimed filmmaker Joanna Hogg's beguiling latest film is a brilliant and captivating exploration of parental relationships and the things we leave behind."
10,IT'S CHRISTMAS AGAIN,--,Fewer than 50 Ratings,--,IT'S CHRISTMAS AGAIN,"Kids & Family, Holiday, Romance, Drama, Musical",English,Sandra L. Martin,,Sandra L. Martin,"Nov 29, 2022  Limited",,,1h 45m,Fathom Events,"Jake Young (Lawson Touliatos) wants nothing more than to spend his Christmas vacation with his girlfriend, Abbey Walker (Leela Owen). So when Abbey volunteers for her church's Christmas play, Jake is ready to skip Christmas this year until an unexpected turn of events lands him in a field outside Bethlehem on the night Jesus was born. While on his journey with the shepherds to find the promised Messiah, Jake discovers the true meaning of Christmas. Coming this Christmas season, IT'S CHRISTMAS AGAIN is a modern-day musical the whole family will love!"
11,EVANGELION:3.0+1.01 THRICE UPON A TIME,--,500+ Ratings,100%,EVANGELION:3.0+1.01 THRICE UPON A TIME,"Sci-Fi, Action, Anime, Drama",Japanese,"Hideaki Anno, Mahiro Maeda, Katsuichi Nakayama, Kazuya Tsurumaki",,Hideaki Anno,"Nov 30, 2022  Limited","Aug 13, 2021",,2h 34m,GKIDS / Fathom Events,"From legendary director Hideaki Anno, EVANGELION:3.0+1.01 THRICE UPON A TIME is the fourth and final installment of the REBUILD OF EVANGELION films, bringing an epic conclusion to the story of Shinji and his fellow Eva pilots, with the stunning visuals and thought-provoking storytelling that has made EVANGELION a global pop culture phenomenon. Misato and her anti-NERV group Wille arrive at Paris, a city now red from core-ization. Crew from the flagship Wunder land on a containment tower. They only have 720 seconds to restore the city. When a horde of NERV Evas appear, Mari's improved Eva Unit 8 must intercept. Meanwhile, Shinji, Asuka, and Rei (Provisional Name) wander about Japan."
12,NCT DREAM THE MOVIE: IN A DREAM,97%,Fewer than 50 Verified Ratings,--,NCT DREAM THE MOVIE: IN A DREAM,"Documentary, Music",,Oh Yoon Dong,,,"Nov 30, 2022  Limited",,,1h 57m,Trafalgar Releasing,South Korean pop group NCT Dream performs two concerts over two sold-out nights.
13,PORTRAIT OF THE QUEEN,--,Fewer than 50 Ratings,--,PORTRAIT OF THE QUEEN,"Documentary, Biography",English,Unknown Director,,,"Nov 30, 2022  Limited",,,1h 40m,Fathom Events,"Queen Elizabeth II was the most photographed, the most loved and talked about, spied upon, praised, criticized, popular woman on the planet. All over the globe and in every moment of her long life, that came to an end at the age of 96, people have always wanted to watch her through a peephole, discover new things about her, get to know her better, connect with her and understand her. Portrait of the Queen offers an original portrayal of the story of The Queen from a totally new perspective: through the most intense, amazing, revealing photographic portraits of her, as shared by the extraordinary photographers who accompanied and often created the image of the British monarchy itself. Special focus is given to each of The Queen's most intense, intimate, faithful portraits, symbols of 20th century history, contextualized by the photographers who portrayed Her Majesty -- Brian Aris, Jason Bell, Julian Calder, Chris Levine, David Montgomery, and John Swannell."
14,THE HARBINGER,--,0 Ratings,96%,THE HARBINGER,"Horror, Mystery & Thriller, Drama",English,Andy Mitton,"Jay Dunn, Richard W. King, Andy Mitton, Clark Freeman",Andy Mitton,"Dec 1, 2022  Limited","Dec 1, 2022",,1h 26m,XYZ Films,"Plagued by horrific nightmares, a woman enters a hellish dreamscape to confront her greatest fears."
15,NEIL YOUNG: HARVEST TIME,86%,Fewer than 50 Ratings,100%,NEIL YOUNG: HARVEST TIME,"Documentary, Music",English,Neil Young,Gary Ward,,"Dec 1, 2022  Limited",,,2h 5m,Trafalgar Releasing,"Created between January and September 1971, this docu-film takes us on an intimate journey to Young’s farm in Northern California for the 'Harvest Barn' sessions, to London for an iconic performance with the London Symphony Orchestra and to Nashville where the then 20 something Neil Young worked on various tracks of this signature album. The feature is a fan piece that has never been seen before. Performance and rehearsal content is intertwined into creative storytelling and includes most of the tracks from album Harvest (released in 1972) including ""Heart of Gold"", ""A Man Needs A Maid"", ""Alabama"" and ""Old Man""."
16,I HEARD THE BELLS,98%,250+ Ratings,--,I HEARD THE BELLS,"Drama, Holiday",English,Joshua Enck,Joshua Enck,"Joshua Enck, Jeff Bender","Dec 1, 2022  Limited",,,1h 50m,Fathom Events,"I HEARD THE BELLS tells the inspiring true story behind the beloved Christmas carol and its author, Henry Wadsworth Longfellow. Known as America's Poet, Henry leads an idyllic life -- until the day his world is shattered by tragedy. With a nation divided by Civil War and his family torn apart, Henry puts down his pen, silenced by grief. But it's the sound of Christmas morning that reignites the poet's lost voice as he discovers the resounding hope of rekindled faith."
17,VIOLENT NIGHT,88%,500+ Verified Ratings,70%,VIOLENT NIGHT,"Holiday, Action, Comedy",English,Tommy Wirkola,"Kelly McCormick, David Leitch, Guy Danella","Pat Casey, Worm Miller","Dec 2, 2022  Wide",,,1h 41m,Universal Pictures,"When a team of mercenaries breaks into a wealthy family compound on Christmas Eve, taking everyone inside hostage, the team isn't prepared for a surprise combatant: Santa Claus (David Harbour, Black Widow, Stranger Things series) is on the grounds, and he's about to show why this Nick is no saint."
18,EMANCIPATION,100%,Fewer than 50 Verified Ratings,50%,EMANCIPATION,"History, Drama, Mystery & Thriller",English,Antoine Fuqua,"Will Smith, Jon Mone, Joey McFarland, Todd Black",Bill Collage,"Dec 2, 2022  Limited","Dec 9, 2022",,2h 12m,Apple TV+,"""Emancipation"" tells the triumphant story of Peter (Will Smith), a man who escapes from slavery, relying on his wits, unwavering faith and deep love for his family to evade cold-blooded hunters and the unforgiving swamps of Louisiana on his quest for freedom. The film is inspired by the 1863 photos of ""Whipped Peter,"" taken during a Union Army medical examination, that first appeared in Harper's Weekly. One image, known as ""The Scourged Back,"" which shows Peter’s bare back mutilated by a whipping delivered by his enslavers, ultimately contributed to growing public opposition to slavery."
19,THE ETERNAL DAUGHTER,71%,Fewer than 50 Ratings,96%,THE ETERNAL DAUGHTER,"Mystery & Thriller, Drama",English,Joanna Hogg,"Ed Guiney, Andrew Lowe, Emma Norton, Joanna Hogg",Joanna Hogg,"Dec 2, 2022  Limited","Dec 2, 2022",,1h 36m,A24,"An artist and her elderly mother confront long-buried secrets when they return to a former family home, now a hotel haunted by its mysterious past. Featuring a towering, deeply moving performance by Tilda Swinton, acclaimed filmmaker Joanna Hogg's beguiling latest film is a brilliant and captivating exploration of parental relationships and the things we leave behind."
20,THE INSPECTION,93%,Fewer than 50 Verified Ratings,86%,THE INSPECTION,"Drama, Lgbtq+",English,Elegance Bratton,"Chester Algernal Gordon, Effie Brown",Elegance Bratton,"Dec 2, 2022  Wide",,$161.0K,1h 34m,A24,"In Elegance Bratton's deeply moving film inspired by his own story, a young, gay Black man, rejected by his mother and with few options for his future, decides to join the Marines, doing whatever it takes to succeed in a system that would cast him aside. But even as he battles deep-seated prejudice and the grueling routines of basic training, he finds unexpected camaraderie, strength, and support in this new community, giving him a hard-earned sense of belonging that will shape his identity and forever change his life."
21,CHRISTMAS WITH THE CAMPBELLS,71%,Fewer than 50 Ratings,44%,CHRISTMAS WITH THE CAMPBELLS,"Holiday, Romance, Comedy",English,Clare Niederpruem,"Peter Billingsley, Dan Lagana, Vince Vaughn","Barbara Kymlicka, Vince Vaughn, Dan Lagana","Dec 2, 2022  Limited","Dec 2, 2022",,1h 28m,RLJE Films,"The traditional holiday romance movie, from the writer of ""You Light Up My Christmas"" and the director of ""The Christmas Bow"", gets a little more fun this year with a spin from co-writers Vince Vaughn (""Couples Retreat"") and Dan Lagana (""American Vandal""). In ""Christmas with The Campbells"", when Jesse gets dumped right before the holidays by her boyfriend Shawn, his parents convince her to still spend Christmas with them, and Shawn's handsome cousin, while Shawn is away."
22,CLOSE,--,Fewer than 50 Ratings,91%,CLOSE,Drama,Dutch,Lukas Dhont,"Michiel Dhont, Dirk Impens","Lukas Dhont, Angelo Tijssens","Dec 2, 2022  Limited",,,1h 45m,A24,"Leo and Remi are two thirteen-year-old best friends, whose seemingly unbreakable bond is suddenly, tragically torn apart. Winner of the Grand Jury Prize at the Cannes Film Festival, Lukas Dhont's second film is an emotionally transformative and unforgettable portrait of the intersection of friendship and love, identity and independence, and heartbreak and healing."
23,LAST FILM SHOW,87%,Fewer than 50 Ratings,94%,LAST FILM SHOW,Drama,Gujarati,Pan Nalin,"Marc Duale, Dheer Momaya, Pan Nalin",Pan Nalin,"Dec 2, 2022  Limited",,,1h 50m,Samuel Goldwyn Films,"Samay, a 9-year-old boy living with his family in a remote village in India discovers films for the first time and is absolutely mesmerized. Against his father's wishes, he returns to the cinema day after day to watch more films, and even befriends the projectionist, who, in exchange for his lunch box, lets him watch movies for free. He quickly figures out that stories become light, light becomes films, and films become dreams. Samay and his wild gang of friends move heaven and earth to catch and project light to achieve a 35mm film projection. Together, they use an innovative hack and jubilantly succeed in making a film projection apparatus. But following your dreams often means leaving things behind."
24,HUNT,--,Fewer than 50 Ratings,62%,HUNT,"Drama, Action, Mystery & Thriller",Korean,Lee Jung-jae,"Han Jae-duk, Lee Jung-jae",Lee Jung-jae,"Dec 2, 2022  Limited","Dec 2, 2022",,2h 11m,Magnet Releasing,"After a high-ranking North Korean official requests asylum, KCIA Foreign Unit chief Park Pyong-ho (LEE Jung Jae) and Domestic Unit chief Kim Jung-do (JUNG Woo Sung) are tasked with uncovering a North Korean spy, known as Donglim, who is deeply embedded within their agency. When the spy begins leaking top secret intel that could jeopardize national security, the two units are each assigned to investigate each other. In this tense situation where if they cannot find the mole, they may be accused themselves, Pyong-ho and Jung-do slowly start to uncover the truth. In the end, they must deal with an unthinkable plot to assassinate the South Korean president..."
25,2ND CHANCE,--,0 Ratings,89%,2ND CHANCE,"Documentary, Biography",English,Ramin Bahrani,"Daniel M. Turcan, Johnny Galvin, Charles Dorfman, Ramin Bahrani, Jacob Grodnik",Ramin Bahrani,"Dec 2, 2022  Limited",,,1h 29m,Bleecker Street,"In 1969 a bankrupt pizzeria owner, Richard Davis, invented the modern-day bullet proof vest. To prove that it worked, he shot himself -- point blank -- 192 times. He launched Second Chance, which became the largest body armor company in the world, saving over 3,000 lives. Charming and brash, Davis also directed over eight hours of cult marketing films, both violent and humorous, and became a celebrity figure among police and gun owners across the country. But when a police officer dies wearing a Second Chance vest, Davis's friend and employee becomes a government whistleblower in a case against the company. This exploration of Davis' rise and fall reveals a man of contradictions, decades of reckless lies and threats and the nature of power and impunity in America."
26,SAVAGE SALVATION,67%,Fewer than 50 Ratings,--,SAVAGE SALVATION,"Action, Mystery & Thriller",English,Randall Emmett,"Randall Emmett, George Furla, Petr Jákl, Nick Koskoff, Shaun Sanghani, Timothy C. Sullivan, Chad A. Verdi","Adam Taylor Barker, Chris Sivertson","Dec 2, 2022  Limited","Dec 2, 2022",,1h 41m,The Avenue,"Sheriff Church (Robert De Niro) and Detective Zeppelin strive to keep the peace in their rough town, where residents' only two interests are the church or oxycodone. Newly engaged Shelby John (Jack Huston) and Ruby Red want a fresh start. They decide to have a family together and get clean, with the support of Peter, Ruby's brother-in-law (John Malkovich). However Shelby discovers his beloved Ruby dead on their porch before she could fulfill her final wish: to be baptized in the river and washed away from her past sins. Filled with fiery rage, Shelby embarks on a vengeful killing spree to right all the wrong done to Ruby by every link in the drug dealing chain. Armed with nothing but adrenaline and a nail gun, Shelby picks off dealers and junkies one by one until he gets to the top. Sheriff Church and Detective Zeppelin must race against the clock to put an end to Shelby's vigilante justice before his fight with the crime lord Coyote (Quavo) turns the entire town into a bloodbath."
27,TANTURA,--,Fewer than 50 Ratings,93%,TANTURA,Documentary,Hebrew,Alon Schwarz,"Maiken Baird, Alon Schwarz, Shaul Schwarz","Halil Efrat, Alon Schwarz, Shaul Schwarz","Dec 2, 2022  Limited",,,1h 35m,Reel Peak Films,"The tape-recorded words ""erase it"" take on new weight in the context of history and war. When the State of Israel was established in 1948, war broke out and hundreds of Palestinian villages were depopulated in its aftermath. Israelis know this as the War of Independence. Palestinians call it ""Al Nakba"" (the Catastrophe). In the late 1990s, graduate student Teddy Katz conducted research into a large-scale massacre that had allegedly occurred in the village of Tantura in 1948. His work later came under attack and his reputation was ruined, but 140 hours of audio testimonies remain. Director Alon Schwarz revisits former Israeli soldiers of the Alexandroni Brigade as well as Palestinian residents in an effort to re-examine what happened in Tantura and explore why the Nakba is taboo in Israeli society. The ex-soldiers, now in their 90s, recall unsettling acts of war while disquietly pausing at points they either don't remember or won't speak of. Audio from Katz's 20-year-old interviews cuts through the silence of self-preservation and exposes the ways in which power, silencing, and protected narratives can sculpt history."
28,FOUR SAMOSAS,100%,Fewer than 50 Ratings,65%,FOUR SAMOSAS,"Comedy, Action, Romance",English,Ravi Kapoor,"Ravi Kapoor, Rajiv Maikhuri, Venk Potula, Craig Stovel",Ravi Kapoor,"Dec 2, 2022  Limited","Dec 2, 2022",,1h 20m,IFC Films,"When a wanna-be rapper learns his ex is engaged to marry his smarmy rival, he and three other misfit dreamers plan a heist to steal her wedding diamonds and win her back in this feel-good family caper."
29,RETURN TO SEOUL,--,Fewer than 50 Ratings,97%,RETURN TO SEOUL,Drama,English,Davy Chou,"Katia Khazak, Charlotte Vincent",Davy Chou,"Dec 2, 2022  Limited",,,1h 59m,Sony Pictures Classics,"On an impulse to reconnect with her origins, Freddie, 25, returns to South Korea for the first time, where she was born before being adopted and raised in France. The headstrong young woman starts looking for her biological parents in a country she knows so little about, taking her life in new and unexpected directions."
30,ANGRY NEIGHBORS,--,0 Ratings,--,ANGRY NEIGHBORS,Comedy,English,Warren Brock,"Warren Brock, Kerry Orent, Mike Sobiloff, Camille Torabpour, Hamid Torabpour","James M. Bear, Hamid Torabpour","Dec 2, 2022  Limited","Dec 2, 2022",,1h 20m,Lionsgate,"When his ultra-wealthy neighbor in the Hamptons builds an obnoxious mega-mansion next door, grumpy retired novelist Harry March concocts an elaborate scheme for revenge that is destined to go hilariously awry."
31,WHAT REMAINS,100%,Fewer than 50 Ratings,40%,WHAT REMAINS,Drama,English,Nathan Scoggins,Ralph Winter,Nathan Scoggins,"Dec 2, 2022  Limited",,,1h 41m,Gravitas Ventures,"A small town pastor is forced to reckon with an act of forgiveness when the convict he forgave for murdering his wife returns to town five years later, while the town sheriff investigates another murder that may be related."
32,NR. 10,--,0 Ratings,67%,NR. 10,"Mystery & Thriller, Drama, Sci-Fi",German,Alex van Warmerdam,Marc van Warmerdam,Alex van Warmerdam,"Dec 2, 2022  Limited","Dec 9, 2022",,1h 40m,Drafthouse Films,"Günter was raised by foster parents after being found abandoned in the woods with no memory as a child. Years later, when a man approaches him on the street and whispers a strange word in his ear, he begins to experience visions from his fractured past that reveal a dark secret, threatening what he thinks he knows about his life and the very nature of his existence."
33,THE QUINTESSENTIAL QUINTUPLETS MOVIE,96%,100+ Verified Ratings,--,THE QUINTESSENTIAL QUINTUPLETS MOVIE,"Romance, Comedy, Anime",Japanese,Masato Jinbo,,Keiichiro Ochi,"Dec 2, 2022  Limited",,,2h 15m,Crunchyroll,"When five lovely young girls who hate studying hire part-time tutor Futaro, he guides not only their education but also their hearts. Time spent has brought them all closer, with feelings growing within the girls and Futaro. As they finish their third year of high school and their last school festival approaches, they set their sights on what's next. Is there a future with one of them and Futaro?"
34,THE QUIET EPIDEMIC,--,0 Ratings,--,THE QUIET EPIDEMIC,Documentary,English,"Winslow Crane-Murdoch, Lindsay Keys","Chris Hegedus, Lindsay Keys, Daria Lombroso",,"Dec 2, 2022  Limited",,,1h 42m,First Run Features,"After years of living with mysterious symptoms, a young girl from Brooklyn and a Duke University scientist are diagnosed with a disease said to not exist: Chronic Lyme disease. The Quiet Epidemic follows their search for answers, which lands them in the middle of a vicious medical debate. What begins as a patient story evolves into an investigation into the history of Lyme disease, dating back to its discovery in 1975. A paper trail of suppressed scientific research, and buried documents reveals why ticks -- and the diseases they carry -- have been allowed to quietly spread around the globe."
35,TWISTED,97%,Fewer than 50 Ratings,--,TWISTED,Mystery & Thriller,English,Vibeke Muasya,Lene Børglum,"Vibeke Muasya, Vibeke Muasya, Nikolaj Scherfig","Dec 2, 2022  Limited",,,1h 27m,Alarm Pictures,"A young woman seeks independence from her protective mother, only to be questioning her own sanity when newfound friends die, and her mother suggests Hannah is the cause of their death."
