,Movie Name,Audience Score,AUDIENCE SCORE reviews,Tomatometer Score,TOMATOMETER reviews,Genre,Original Language,Director,Producer,Writer,Release Date (Theaters),Release Date (Streaming),box office,Runtime,Distributor,MOVIE INFO
775,FRAMING AGNES,--,0 Ratings,76%,FRAMING AGNES,"Documentary, Lgbtq+",English,Chase Joynt,"Samantha Curley, Shant Joshi, Chase Joynt","Chase Joynt, Morgan M. Page, Chase Joynt, Morgan M. Page","Dec 2, 2022  Limited","Jan 31, 2023",,1h 15m,Kino Lorber,"The pseudonymous Agnes was a pioneering transgender woman who participated in an infamous gender health study conducted at UCLA in the 1960s. Her clever use of the study to gain access to gender-affirming healthcare led to her status as a fascinating and celebrated figure in trans history. In this innovative cinematic exercise that blends fiction and nonfiction, director Chase Joynt (No Ordinary Man) uses Agnes's story, along with others unearthed in long-shelved case files, to widen the frame through which trans history is viewed. Through a collaborative practice of reimagination, an all-star cast of trans performers, artists, and thinkers -- including Angelica Ross (Pose), Jen Richards (Mrs. Fletcher), and Zackary Drucker (Transparent) -- take on vividly rendered, impeccably vintage reenactments, bringing to life groundbreaking artifacts of trans history. This collective reclamation breaks down the myth of isolation among transgender history-makers, breathing new life into a lineage of collaborators and conspirators who have been forgotten for far too long."
776,AMIGO,--,0 Ratings,100%,AMIGO,"Mystery & Thriller, Comedy",Spanish (Spain),Óscar Martín,Elena Muñoz,"Óscar Martín, Javier Botet, David Pareja","Dec 2, 2022  Limited",,,1h 23m,Dekanalog,"Following a car accident that kills his wife and leaves his best friend David (David Pareja) with nothing but a scratch, Javi (Javier Botet, REC, Crimson Peak) is left bedridden. His body bears deep gashes, his lungs are filled with fluid that make talking painful and near impossible, his legs are inoperable. From scene one, we see the dynamic at play between the two survivors. David carries Javi into the house. They are fresh from the hospital, and David assures Javi that he will be there to care for him. But... something is not right. Javi does not want David's help. David starts noticing things out of place. He starts suspecting Javi of gaslighting him, despite the fact that Javi can barely move of his own volition. In a series of torturous scenes, the power dynamic settles into a disquieting groove. Reaching an aching fever pitch...."
777,LOWNDES COUNTY AND THE ROAD TO BLACK POWER,--,Fewer than 50 Ratings,100%,LOWNDES COUNTY AND THE ROAD TO BLACK POWER,"Documentary, History",English,"Geeta Gandbhir, Samuel D. Pollard","Jessica Devaney, Anya Rous, Dema Paxton Fofang",Dema Paxton Fofang,"Dec 2, 2022  Limited","Dec 2, 2022",,1h 29m,Greenwich Entertainment,"In the mid-1960s, Lowndes County, Alabama had zero registered Black voters despite an 80% Black population. Through first person accounts and searing archival footage, this documentary chronicles the citizens' movement and young Student Nonviolent Coordinating Committee (SNCC) organizers led by Stokely Carmichael who risked their lives for Black voting rights."
778,HASHTAG BLESSED: THE MOVIE,--,0 Ratings,--,HASHTAG BLESSED: THE MOVIE,"Kids & Family, Holiday, Drama, Romance",English,Stephanie McBain,"Dalea Faulkner, Martina Webster",Dalea Faulkner,"Dec 2, 2022  Limited","Dec 9, 2022",,1h 30m,Entertainment Squad,"It’s Christmastime and Jessi is all but excited. She finds herself with comparisonitis in the world of social media. Other women her age just seem to “have it all”, including that engagement ring. Jessi finds herself frustrated over her job at the local movie theater, still struggling with the loss of her parents, and drowning in student loan debt. Her Grandma and friends seem to be concerned for her health and well being, and only want Jessi to be happy. Will Jessi ever see the love that is right in front of her? Will she continue down her dark path of negativity and struggle, or will the magic of Christmas shine light on her future?"
779,ALMIGHTY ZEUS,--,0 Ratings,--,ALMIGHTY ZEUS,"Action, Drama, Sports",English,Chris Soriano,"Julian Brantley, Luis Jorge Rios",Chris Soriano,"Dec 2, 2022  Limited",,,1h 55m,TriCoast Worldwide,"When an old Asian man is attacked and sprayed with hand sanitizer, a young boxer knocks out the aggressor. This turns him into a viral star which gets the attention of the Middleweight champion, who decides to challenge the young boxer in the ring to an unorthodox boxing match in a COVID-19 pandemic."
780,RENEGADES,--,0 Ratings,--,RENEGADES,"Action, Crime, Drama, Mystery & Thriller",English (United Kingdom),Daniel Zirilli,Jonathan Sothcott,"Tom Jolliffe, Jonathan Sothcott","Dec 2, 2022  Limited","Dec 6, 2022",,1h 31m,Saban Films,"When Veteran Green Beret Carver (Lee Majors) is murdered by a drug gang controlled by Goram (Louis Mandylor) that has been threatening his daughter (Patsy Kensit), his old Special Forces comrades (Nick Moran, Ian Ogilvy, Billy Murray, Paul Barber) reunite to seek revenge, aided by the enigmatic Sanchez (Danny Trejo). As these Renegades dispense their own brand of justice on the mean streets of London with the police (Jeanine Nerissa Sothcott) hot on their trail, they must use every trick in their war hero playbook to stay one step ahead of the sinister gang."
781,REFLECTIONS OF A BROKEN MEMORY,--,Fewer than 50 Ratings,--,REFLECTIONS OF A BROKEN MEMORY,Drama,English,Marco Bazzi,Marco Bazzi,Marco Bazzi,"Dec 2, 2022  Limited",,,1h 20m,Indican Pictures,"Under the guidance of a clinical therapist, a detective leads a suspect into his unconscious to unlock the forgotten memories that caused him to lose touch with reality."
782,BLACK PANTHER: WAKANDA FOREVER,94%,"10,000+ Verified Ratings",84%,BLACK PANTHER: WAKANDA FOREVER,"Action, Adventure, Fantasy",English,Ryan Coogler,"Kevin Feige, Nate Moore","Ryan Coogler, Joe Robert Cole","Nov 11, 2022  Wide",,$367.5M,2h 41m,Walt Disney Pictures,"In Marvel Studios' ""Black Panther: Wakanda Forever,"" Queen Ramonda (Angela Bassett), Shuri (Letitia Wright), M'Baku (Winston Duke), Okoye (Danai Gurira) and the Dora Milaje (including Florence Kasumba) fight to protect their nation from intervening world powers in the wake of King T'Challa's death. As the Wakandans strive to embrace their next chapter, the heroes must band together with the help of War Dog Nakia (Lupita Nyong'o) and Everett Ross (Martin Freeman) and forge a new path for the kingdom of Wakanda."
783,STRANGE WORLD,65%,500+ Verified Ratings,75%,STRANGE WORLD,"Kids & Family, Comedy, Adventure, Fantasy, Animation, Action",English,"Don Hall, Qui Nguyen",Roy Conli,Qui Nguyen,"Nov 23, 2022  Wide",,$18.9M,1h 42m,Walt Disney Pictures,"Walt Disney Animation Studios' original action-packed adventure ""Strange World"" introduces a legendary family of explorers, the Clades, as they attempt to navigate an uncharted, treacherous land alongside a motley crew that includes a mischievous blob, a three-legged dog and a slew of ravenous creatures."
784,DEVOTION,92%,500+ Verified Ratings,82%,DEVOTION,"War, History, Drama, Action",English,"J.D. Dillard, Erik Messerschmidt, Billy Fox, Deirdra Elizabeth Govan","Thad Luckinbill, Trent Luckinbill, Molly Smith, Rachel Smith","Jonathan C. Stewart, Jake Crane, Jonathan A. H. Stewart","Nov 23, 2022  Wide",,$9.0M,2h 19m,Columbia Pictures,"Devotion, an aerial war epic based on the bestselling book of the same name, tells the harrowing true story of two elite US Navy fighter pilots during the Korean War. Their heroic sacrifices would ultimately make them the Navy's most celebrated wingmen."
785,THE MENU,78%,"1,000+ Verified Ratings",89%,THE MENU,"Horror, Mystery & Thriller, Comedy",English,Mark Mylod,"Adam McKay, Betsy Koch, Will Ferrell","Seth Reiss, Will Tracy","Nov 18, 2022  Wide",,$18.9M,1h 47m,Searchlight Pictures,"A couple (Anya Taylor-Joy and Nicholas Hoult) travels to a coastal island to eat at an exclusive restaurant where the chef (Ralph Fiennes) has prepared a lavish menu, with some shocking surprises."
786,BLACK ADAM,89%,"5,000+ Verified Ratings",39%,BLACK ADAM,"Action, Adventure, Fantasy",English,Jaume Collet-Serra,"Beau Flynn, Hiram Garcia, Dwayne Johnson, Dany Garcia","Adam Sztykiel, Rory Haines, Sohrab Noshirvani","Oct 21, 2022  Wide","Nov 22, 2022",$162.8M,2h 5m,Warner Bros. Pictures,"Nearly 5,000 years after he was bestowed with the almighty powers of the ancient gods--and imprisoned just as quickly--Black Adam (Dwayne Johnson) is freed from his earthly tomb, ready to unleash his unique form of justice on the modern world."
787,THE FABELMANS,82%,500+ Verified Ratings,91%,THE FABELMANS,Drama,English,Steven Spielberg,"Kristie Macosko Krieger, Steven Spielberg, Tony Kushner","Steven Spielberg, Tony Kushner","Nov 23, 2022  Wide",,$3.5M,2h 31m,Universal Pictures,"Young Sammy Fabelman falls in love with movies after his parents take him to see ""The Greatest Show on Earth."" Armed with a camera, Sammy starts to make his own films at home, much to the delight of his supportive mother."
788,BONES AND ALL,62%,100+ Verified Ratings,83%,BONES AND ALL,"Mystery & Thriller, Romance, Drama",English,Luca Guadagnino,"Luca Guadagnino, Theresa Park, Marco Morabito, David Kajganich, Francesco Melzi d'Eril, Lorenzo Mieli, Gabriele Moratti, Peter Spears, Timothée Chalamet",David Kajganich,"Nov 23, 2022  Wide",,$3.8M,2h 10m,United Artists Releasing,"BONES AND ALL is a story of first love between Maren, a young woman learning how to survive on the margins of society, and Lee, an intense and disenfranchised drifter; a liberating road odyssey of two young people coming into their own, searching for identity and chasing beauty in a perilous world that cannot abide who they are."
789,TICKET TO PARADISE,87%,"2,500+ Verified Ratings",57%,TICKET TO PARADISE,"Romance, Comedy",English,Ol Parker,"Tim Bevan, Eric Fellner, Sarah Harvey, Deborah Balderstone","Ol Parker, Daniel Pipski","Oct 21, 2022  Wide","Dec 9, 2022",$65.1M,1h 44m,Universal Pictures,"Academy Award® winners George Clooney and Julia Roberts reunite on the big screen as exes who find themselves on a shared mission to stop their lovestruck daughter from making the same mistake they once made. From Working Title, Smokehouse Pictures and Red Om Films, Ticket to Paradise is a romantic comedy about the sweet surprise of second chances."
790,SHE SAID,91%,250+ Verified Ratings,87%,SHE SAID,Drama,English,Maria Schrader,"Dede Gardner, Jeremy Kleiner",Rebecca Lenkiewicz,"Nov 18, 2022  Wide",,$4.3M,2h 9m,Universal Pictures,"Two-time Academy Award® nominee Carey Mulligan (Promising Young Woman, An Education) and Zoe Kazan (The Plot Against America limited series, The Big Sick) star as New York Times reporters Megan Twohey and Jodi Kantor, who together broke one of the most important stories in a generation--a story that helped propel the #Metoo movement, shattered decades of silence around the subject of sexual assault in Hollywood and altered American culture forever."
791,"LYLE, LYLE, CROCODILE",93%,"1,000+ Verified Ratings",73%,"LYLE, LYLE, CROCODILE","Kids & Family, Musical, Comedy, Animation",English,"Will Speck, Josh Gordon","Hutch Parker, Will Speck, Josh Gordon",Will Davies,"Oct 7, 2022  Wide",,$45.2M,1h 46m,Columbia Pictures,"When the Primm family (Constance Wu, Scoot McNairy, Winslow Fegley) moves to New York City, their young son Josh struggles to adapt to his new school and new friends. All of that changes when he discovers Lyle - a singing crocodile (Shawn Mendes) who loves baths, caviar and great music-living in the attic of his new home. The two become fast friends, but when Lyle's existence is threatened by evil neighbor Mr. Grumps (Brett Gelman), the Primm's must band together with Lyle's charismatic owner, Hector P. Valenti (Javier Bardem), to show the world that family can come from the most unexpected places and there's nothing wrong with a big singing crocodile with an even bigger personality."
792,SMILE,77%,"2,500+ Verified Ratings",79%,SMILE,"Horror, Mystery & Thriller",English,Parker Finn,"Marty Bowen, Wyck Godfrey, Isaac Klausner, Robert Salerno",Parker Finn,"Sep 30, 2022  Wide","Nov 15, 2022",$105.5M,1h 56m,Paramount Pictures,"After witnessing a bizarre, traumatic incident involving a patient, Dr. Rose Cotter (Sosie Bacon) starts experiencing frightening occurrences that she can't explain. As an overwhelming terror begins taking over her life, Rose must confront her troubling past in order to survive and escape her horrifying new reality."
793,PREY FOR THE DEVIL,69%,250+ Verified Ratings,16%,PREY FOR THE DEVIL,"Horror, Mystery & Thriller",English,Daniel Stamm,"Paul Brooks, Todd R. Jones, Earl Richey Jones, Jessica Malanaphy","Robert Zappia, Earl Richey Jones, Todd R. Jones","Oct 28, 2022  Wide",,$19.1M,1h 33m,Lionsgate,"Sister Ann (Jacqueline Byers) believes she is answering a calling to be the first female exorcist... but who, or what, called her? In response to a global rise in demonic possessions, Ann seeks out a place at an exorcism school reopened by the Catholic Church. Until now these schools have only trained priests in the Rite of Exorcism -- but a professor (Colin Salmon) recognizes Sister Ann's gifts and agrees to train her. Thrust onto the spiritual frontline with fellow student Father Dante (Christian Navarro), Sister Ann finds herself in a battle for the soul of a young girl, who Sister Ann believes is possessed by the same demon that tormented her own mother years ago. Determined to root out the evil, Ann soon realizes the Devil has her right where he wants her."
794,THE BANSHEES OF INISHERIN,76%,500+ Verified Ratings,97%,THE BANSHEES OF INISHERIN,Comedy,English,Martin McDonagh,"Graham Broadbent, Peter Czernin, Martin McDonagh",Martin McDonagh,"Nov 4, 2022  Wide","Dec 13, 2022",$7.9M,1h 49m,Searchlight Pictures,"Set on a remote island off the west coast of Ireland, THE BANSHEES OF INISHERIN follows lifelong friends Pádraic and Colm, who find themselves at an impasse when Colm unexpectedly puts an end to their friendship. A stunned Pádraic, aided by his sister Siobhán and troubled young islander Dominic, endeavours to repair the relationship, refusing to take no for an answer. But Pádraic's repeated efforts only strengthen his former friend’s resolve and when Colm delivers a desperate ultimatum, events swiftly escalate, with shocking consequences."
795,ONE PIECE FILM RED,95%,"1,000+ Verified Ratings",94%,ONE PIECE FILM RED,"Action, Adventure, Anime",Japanese,Goro Taniguchi,Eiichiro Oda,"Eiichiro Oda, Tsutomu Kuroiwa","Nov 4, 2022  Wide",,$8.6M,1h 55m,Crunchyroll,"Uta -- the most beloved singer in the world. Renowned for concealing her own identity when performing, her voice has come to be described as ""otherworldly."" Now, for the first time ever, Uta will reveal herself to the world at a live concert. As the venue fills with all kinds of Uta fans -- excited pirates, the Navy watching closely, and the Straw Hats led by Luffy who simply came to enjoy her sonorous performance -- the voice that the whole world has been waiting for is about to resound. The story begins with the shocking fact that she is Shanks' daughter."
796,THE WOMAN KING,99%,"5,000+ Verified Ratings",94%,THE WOMAN KING,"Action, Adventure, History, Drama, War",English,Gina Prince-Bythewood,"Cathy Schulman, Viola Davis, Julius Tennon, Maria Bello",Dana Stevens,"Sep 16, 2022  Wide",,$67.0M,2h 15m,TriStar Pictures,"The Woman King is the remarkable story of the Agojie, the all-female unit of warriors who protected the African Kingdom of Dahomey in the 1800s with skills and a fierceness unlike anything the world has ever seen. Inspired by true events, The Woman King follows the emotionally epic journey of General Nanisca (Oscar®-winner Viola Davis) as she trains the next generation of recruits and readies them for battle against an enemy determined to destroy their way of life. Some things are worth fighting for...."
797,TRIANGLE OF SADNESS,73%,500+ Ratings,69%,TRIANGLE OF SADNESS,Comedy,English,Ruben Östlund,"Philippe Bober, Erik Hemmendorff",Ruben Östlund,"Oct 7, 2022  Limited",,$4.0M,2h 29m,NEON,"In Ruben Östlund's wickedly funny Palme d'Or winner, social hierarchy is turned upside down, revealing the tawdry relationship between power and beauty. Celebrity model couple, Carl (Harris Dickinson) and Yaya (Charlbi Dean), are invited on a luxury cruise for the uber-rich, helmed by an unhinged boat captain (Woody Harrelson). What first appeared instagrammable ends catastrophically, leaving the survivors stranded on a desert island and fighting for survival."
798,TÁR,72%,250+ Verified Ratings,90%,TÁR,"Drama, Music",English,Todd Field,"Todd Field, Alexandra Milchan, Scott Lambert",Todd Field,"Oct 28, 2022  Wide",,$5.1M,2h 38m,Focus Features,"From writer-producer-director Todd Field comes TÁR, starring Cate Blanchett as Lydia Tár, the groundbreaking conductor of a major German Orchestra. We meet Tár at the height of her career, as she's preparing both a book launch and much-anticipated live performance of Mahler's Fifth Symphony. Over the ensuing weeks her life begins to unravel in a singularly modern way. The result is a searing examination of power, and its impact and durability in today's society."
799,TILL,97%,500+ Verified Ratings,98%,TILL,Drama,English,Chinonye Chukwu,"Keith Beauchamp, Barbara Broccoli, Whoopi Goldberg, Thomas Levine, Michael Reilly, Frederick Zollo","Michael Reilly, Keith Beauchamp, Chinonye Chukwu","Oct 28, 2022  Wide",,$8.7M,2h 10m,United Artists Releasing,"Till is a profoundly emotional and cinematic film about the true story of Mamie Till Mobley's relentless pursuit of justice for her 14 year old son, Emmett Till, who, in 1955, was brutally lynched while visiting his cousins in Mississippi. In Mamie's poignant journey of grief turned to action, we see the universal power of a mother's ability to change the world."
800,MINIONS: THE RISE OF GRU,89%,"10,000+ Verified Ratings",70%,MINIONS: THE RISE OF GRU,"Kids & Family, Comedy, Adventure, Animation",English,Kyle Balda,"Christopher Meledandri, Janet Healy, Chris Renaud",Matthew Fogel,"Jul 1, 2022  Wide","Sep 23, 2022",$369.5M,1h 27m,Universal Pictures,"In the heart of the 1970s, amid a flurry of feathered hair and flared jeans, Gru (Oscar® nominee Steve Carell) is growing up in the suburbs. A fanboy of a supervillain supergroup known as the Vicious 6, Gru hatches a plan to become evil enough to join them. Luckily, he gets some mayhem-making backup from his loyal followers, the Minions. Together, Kevin, Stuart, Bob, and Otto--a new Minion sporting braces and a desperate need to please--deploy their skills as they and Gru build their first lair, experiment with their first weapons and pull off their first missions. When the Vicious 6 oust their leader, legendary fighter Wild Knuckles (Oscar® winner Alan Arkin), Gru interviews to become their newest member. It doesn't go well (to say the least), and only gets worse after Gru outsmarts them and suddenly finds himself the mortal enemy of the apex of evil. On the run, Gru will turn to an unlikely source for guidance, Wild Knuckles himself, and discover that even bad guys need a little help from their friends."
801,ARMAGEDDON TIME,48%,100+ Verified Ratings,76%,ARMAGEDDON TIME,Drama,English,James Gray,"Anthony Katagas, Marc Butan, Rodrigo Teixeira, James Gray",James Gray,"Nov 4, 2022  Wide",,$1.8M,1h 54m,Focus Features,"From acclaimed filmmaker James Gray, ARMAGEDDON TIME is a deeply personal coming-of-age story about the strength of family and the generational pursuit of the American Dream. The film features an all-star cast including Anthony Hopkins, Anne Hathaway and Jeremy Strong."
802,DECISION TO LEAVE,88%,250+ Ratings,94%,DECISION TO LEAVE,"Mystery & Thriller, Crime, Drama, Romance",Korean,Park Chan-wook,Park Chan-wook,"Park Chan-wook, , Jeong Seo-kyeong","Oct 14, 2022  Limited",,$1.9M,2h 18m,MUBI,"From a mountain peak in South Korea, a man plummets to his death. Did he jump, or was he pushed? When detective Hae-joon arrives on the scene, he begins to suspect the dead man's wife Seo-rae. But as he digs deeper into the investigation, he finds himself trapped in a web of deception and desire."
803,ALL THE BEAUTY AND THE BLOODSHED,0%,Fewer than 50 Ratings,96%,ALL THE BEAUTY AND THE BLOODSHED,"Documentary, Biography",English,Laura Poitras,"Nan Goldin, Howard Gertler, John S. Lyons, Yoni Golijov, Laura Poitras",Laura Poitras,"Nov 23, 2022  Limited",,$38.2K,1h 57m,NEON,"Directed by Academy Award®-winning filmmaker Laura Poitras, All the Beauty and the Bloodshed is an epic, emotional and interconnected story about internationally renowned artist and activist Nan Goldin told through her slideshows, intimate interviews, ground-breaking photography, and rare footage of her personal fight to hold the Sackler family accountable for the overdose crisis."
804,BARBARIAN,71%,"1,000+ Verified Ratings",92%,BARBARIAN,"Horror, Mystery & Thriller",English,Zach Cregger,"Arnon Milchan, Roy Lee, Raphael Margules, J.D. Lifshitz",Zach Cregger,"Sep 9, 2022  Wide","Oct 25, 2022",$40.8M,1h 42m,20th Century Studios,"Traveling to Detroit for a job interview, a young woman books a rental home. But when she arrives late at night, she discovers that the house is double booked and a strange man is already staying there. Against her better judgement, she decides to spend the evening, but soon discovers that there's a lot more to fear than just an unexpected house guest."
805,AMSTERDAM,62%,500+ Verified Ratings,33%,AMSTERDAM,"Comedy, Mystery & Thriller, Crime, Drama",English,David O. Russell,"Arnon Milchan, Matthew Budman, Anthony Katagas, David O. Russell, Christian Bale",David O. Russell,"Oct 7, 2022  Wide","Nov 11, 2022",$14.9M,2h 14m,20th Century Studios,In 1933 three close friends find themselves at the center of one of the most shocking secret plots in American history.
806,FIRE OF LOVE,87%,100+ Ratings,99%,FIRE OF LOVE,"Documentary, Biography",French (Canada),Sara Dosa,"Shane Boris, Ina Fichman, Sara Dosa",,"Jul 6, 2022  Limited","Nov 11, 2022",$1.1M,1h 33m,NEON,"Fire of Love tells the story of two French lovers, Katia and Maurice Krafft, who died in a volcanic explosion doing the very thing that brought them together: unraveling the mysteries of our planet, while simultaneously capturing the most explosive volcano imagery ever recorded. Along the way, they changed our understanding of the natural world, and saved tens of thousands of lives. Previously unseen hours of pristine 16-millimeter film and thousands of photographs reveal the birth of modern volcanology through an unlikely lens -- the love of its two pioneers."
807,DC LEAGUE OF SUPER-PETS,88%,"2,500+ Verified Ratings",73%,DC LEAGUE OF SUPER-PETS,"Kids & Family, Comedy, Adventure, Animation",English,Jared Stern,"Patricia Hicks, Dwayne Johnson, Dany Garcia, Hiram Garcia, Jared Stern","Jared Stern, John Whittington","Jul 29, 2022  Wide","Aug 23, 2022",$93.7M,1h 46m,Warner Bros. Pictures,"In ""DC League of Super-Pets,"" Krypto the Super-Dog and Superman are inseparable best friends, sharing the same superpowers and fighting crime in Metropolis side by side. When Superman and the rest of the Justice League are kidnapped, Krypto must convince a rag-tag shelter pack--Ace the hound, PB the potbellied pig, Merton the turtle and Chip the squirrel--to master their own newfound powers and help him rescue the superheroes."
808,EO,93%,Fewer than 50 Ratings,97%,EO,Drama,Polish,Jerzy Skolimowski,"Ewa Piaskowska, Jerzy Skolimowski, Eileen Tasca","Ewa Piaskowska, Jerzy Skolimowski","Nov 18, 2022  Limited",,$49.4K,1h 28m,Janus Films,"The world is a mysterious place when seen through the eyes of an animal. EO, a grey donkey with melancholic eyes, meets good and bad people on his life's path, experiences joy and pain, endures the wheel of fortune randomly turn his luck into disaster and his despair into unexpected bliss. But not even for a moment does he lose his innocence."
809,SALVATORE: SHOEMAKER OF DREAMS,--,Fewer than 50 Ratings,73%,SALVATORE: SHOEMAKER OF DREAMS,"Documentary, Biography",Italian,Luca Guadagnino,"Francesco Melzi d'Eril, Gabriele Moratti","Dana Thomas, Dana Thomas","Nov 4, 2022  Limited",,$30.0K,2h 0m,Sony Pictures Classics,"The life of Italian shoemaker Salvatore Ferragamo, who created shoes for Hollywood stars during the silent film era and for iconic films of the period."
810,THE GOOD HOUSE,76%,100+ Verified Ratings,72%,THE GOOD HOUSE,"Romance, Comedy, Drama",English,"Maya Forbes, Wallace Wolodarsky","Jane Rosenthal, Berry Welsh, Aaron Ryder","Maya Forbes, Wallace Wolodarsky, Thomas Bezucha","Sep 30, 2022  Limited",,$2.2M,1h 43m,Lionsgate / Roadside Attractions,"The Good House follows Hildy Good (Sigourney Weaver), a wry New England realtor and descendant of the Salem witches, who loves her wine and her secrets. Her compartmentalized life begins to unravel as she rekindles a romance with her old high-school flame, Frank Getchell (Kevin Kline), and becomes dangerously entwined in one person's reckless behavior. Igniting long-buried emotions and family secrets, Hildy is propelled toward a reckoning with the one person she's been avoiding for decades: herself."
