,Movie Name,Audience Score,AUDIENCE SCORE reviews,Tomatometer Score,TOMATOMETER reviews,Genre,Original Language,Director,Producer,Writer,Release Date (Theaters),Release Date (Streaming),box office,Runtime,Distributor,MOVIE INFO
247,AMSTERDAM,62%,500+ Verified Ratings,33%,AMSTERDAM,"Comedy, Mystery & Thriller, Crime, Drama",English,David O. Russell,"Arnon Milchan, Matthew Budman, Anthony Katagas, David O. Russell, Christian Bale",David O. Russell,"Oct 7, 2022  Wide","Nov 11, 2022",$14.9M,2h 14m,20th Century Studios,In 1933 three close friends find themselves at the center of one of the most shocking secret plots in American history.
248,FIRE OF LOVE,87%,100+ Ratings,99%,FIRE OF LOVE,"Documentary, Biography",French (Canada),Sara Dosa,"Shane Boris, Ina Fichman, Sara Dosa",,"Jul 6, 2022  Limited","Nov 11, 2022",$1.1M,1h 33m,NEON,"Fire of Love tells the story of two French lovers, Katia and Maurice Krafft, who died in a volcanic explosion doing the very thing that brought them together: unraveling the mysteries of our planet, while simultaneously capturing the most explosive volcano imagery ever recorded. Along the way, they changed our understanding of the natural world, and saved tens of thousands of lives. Previously unseen hours of pristine 16-millimeter film and thousands of photographs reveal the birth of modern volcanology through an unlikely lens -- the love of its two pioneers."
249,DC LEAGUE OF SUPER-PETS,88%,"2,500+ Verified Ratings",73%,DC LEAGUE OF SUPER-PETS,"Kids & Family, Comedy, Adventure, Animation",English,Jared Stern,"Patricia Hicks, Dwayne Johnson, Dany Garcia, Hiram Garcia, Jared Stern","Jared Stern, John Whittington","Jul 29, 2022  Wide","Aug 23, 2022",$93.7M,1h 46m,Warner Bros. Pictures,"In ""DC League of Super-Pets,"" Krypto the Super-Dog and Superman are inseparable best friends, sharing the same superpowers and fighting crime in Metropolis side by side. When Superman and the rest of the Justice League are kidnapped, Krypto must convince a rag-tag shelter pack--Ace the hound, PB the potbellied pig, Merton the turtle and Chip the squirrel--to master their own newfound powers and help him rescue the superheroes."
250,EO,93%,Fewer than 50 Ratings,97%,EO,Drama,Polish,Jerzy Skolimowski,"Ewa Piaskowska, Jerzy Skolimowski, Eileen Tasca","Ewa Piaskowska, Jerzy Skolimowski","Nov 18, 2022  Limited",,$49.4K,1h 28m,Janus Films,"The world is a mysterious place when seen through the eyes of an animal. EO, a grey donkey with melancholic eyes, meets good and bad people on his life's path, experiences joy and pain, endures the wheel of fortune randomly turn his luck into disaster and his despair into unexpected bliss. But not even for a moment does he lose his innocence."
251,SALVATORE: SHOEMAKER OF DREAMS,--,Fewer than 50 Ratings,73%,SALVATORE: SHOEMAKER OF DREAMS,"Documentary, Biography",Italian,Luca Guadagnino,"Francesco Melzi d'Eril, Gabriele Moratti","Dana Thomas, Dana Thomas","Nov 4, 2022  Limited",,$30.0K,2h 0m,Sony Pictures Classics,"The life of Italian shoemaker Salvatore Ferragamo, who created shoes for Hollywood stars during the silent film era and for iconic films of the period."
252,THE GOOD HOUSE,76%,100+ Verified Ratings,72%,THE GOOD HOUSE,"Romance, Comedy, Drama",English,"Maya Forbes, Wallace Wolodarsky","Jane Rosenthal, Berry Welsh, Aaron Ryder","Maya Forbes, Wallace Wolodarsky, Thomas Bezucha","Sep 30, 2022  Limited",,$2.2M,1h 43m,Lionsgate / Roadside Attractions,"The Good House follows Hildy Good (Sigourney Weaver), a wry New England realtor and descendant of the Salem witches, who loves her wine and her secrets. Her compartmentalized life begins to unravel as she rekindles a romance with her old high-school flame, Frank Getchell (Kevin Kline), and becomes dangerously entwined in one person's reckless behavior. Igniting long-buried emotions and family secrets, Hildy is propelled toward a reckoning with the one person she's been avoiding for decades: herself."
253,LEONOR WILL NEVER DIE,100%,Fewer than 50 Ratings,93%,LEONOR WILL NEVER DIE,Drama,Filipino,Martika Ramirez Escobar,"Monster Jimenez, Mario Cornejo","Martika Ramirez Escobar, Martika Ramirez Escobar","Nov 25, 2022  Limited",,$3.2K,1h 39m,Music Box Films,"Leonor Reyes was once a major player in the Filipino film industry after creating a string of successful action films, but now her household struggles to pay the bills. When she reads an advertisement looking for screenplays, Leonor begins tinkering with an unfinished script about the quest of young, noble Ronwaldo, forced to avenge his brother's murder at the hand of thugs. While her imagination provides some escape from reality, she goes all-in after an accident involving a television knocks her out, sends her into a coma, and transports her inside the incomplete movie. Now Leonor can play out her wildest dreams firsthand and discover the perfect ending to her story."
254,BAD AXE,100%,Fewer than 50 Ratings,95%,BAD AXE,Documentary,English,David Siev,"Jude Hope Harris, Diane Moy Quon, David Siev, Katarina Vasquez",,"Nov 18, 2022  Limited","Nov 18, 2022",$16.7K,1h 42m,IFC Films,"A real-time portrait of 2020 unfolds as an Asian-American family in Trump's rural America fights to keep their restaurant and American dream alive in the face of a pandemic, Neo-Nazis, and generational scars from the Cambodian Killing Fields."
255,DON'T WORRY DARLING,74%,"1,000+ Verified Ratings",38%,DON'T WORRY DARLING,Mystery & Thriller,English,Olivia Wilde,"Olivia Wilde, Katie Silberman, Miri Yoon, Roy Lee",Katie Silberman,"Sep 23, 2022  Wide","Oct 25, 2022",$45.3M,2h 3m,Warner Bros. Pictures,"Alice and Jack are lucky to be living in the idealized community of Victory, the experimental company town housing the men who work for the top-secret Victory Project and their families. The 1950's societal optimism espoused by their CEO, Frank--equal parts corporate visionary and motivational life coach--anchors every aspect of daily life in the tight-knit desert utopia. While the husbands spend every day inside the Victory Project Headquarters, working on the ""development of progressive materials,"" their wives--including Frank's elegant partner, Shelley--get to spend their time enjoying the beauty, luxury and debauchery of their community. Life is perfect, with every resident's needs met by the company. All they ask in return is discretion and unquestioning commitment to the Victory cause. But when cracks in her idyllic life begin to appear, exposing flashes of something much more sinister lurking beneath the attractive façade, Alice can't help questioning exactly what they're doing in Victory, and why. Just how much is Alice willing to lose to expose what's really going on in this paradise?"
256,THERE THERE,--,Fewer than 50 Ratings,45%,THERE THERE,"Drama, Comedy, Romance",English,Andrew Bujalski,"Houston King, Dia Sokol Savage, Sam Bisbee",Andrew Bujalski,"Nov 18, 2022  Limited","Nov 18, 2022",$7.1K,1h 34m,Magnolia Pictures,"Acclaimed filmmaker Andrew Bujalski (Support the Girls, Computer Chess) explores the precarious nature of human connection in There There, a round robin of emotional two-character vignettes in which seven people reach out and bond momentarily, setting the scene for the next encounter. A pair of new lovers, a woman and her AA sponsor, a teacher and a parent, a lawyer and his client, and more, move from scene to scene, changing partners and beginning a new dance of discovery as they do. Via a groundbreaking shooting process, Bujalski plays with the ideas of isolation and perception by filming each actor individually in separate locations without ever seeing their partner's performance. An extraordinary cast including Jason Schwartzman, Lili Taylor, Lennie James and Molly Gordon sensitively captures the humor and heartbreaking fragility of life and love in the 2020s."
257,CAT DADDIES,92%,Fewer than 50 Ratings,82%,CAT DADDIES,Documentary,English,Mye Hoang,"Mye Hoang, Dave Boyle",Mye Hoang,"Oct 14, 2022  Limited",,$48.6K,1h 29m,,"Man has found a new best friend: Tora, Pickles, Lucky, Zulu, Toodles, Flame and GoalKitty. These are just some of the lovable feline stars of director Mye Hoang’s debut documentary film CAT DADDIES. A heartwarming and tender portrait of a diverse group of men whose lives have been forever changed by their love of cats, CAT DADDIES takes us on an inspiring journey all across the United States during the challenging early days of the COVID-19 pandemic when people desperately needed hope and companionship. These nine “cat dads” come from all walks of life – a firefighter, a truck driver, a Hollywood stuntman, an ad executive turned cat rescuer, a police officer, a software engineer, an actor/Instagram influencer, a school teacher and an undocumented and disabled immigrant living on the streets of New York City. They couldn’t be any more different, but each of them has a compelling story to tell and share an unconditional love for their beloved cats. A refreshing and timely exploration of modern masculinity, CAT DADDIES shows us how being a “cat person” has no gender, and that the unlikely bond between man and cat is here to stay."
258,CALL JANE,86%,Fewer than 50 Verified Ratings,82%,CALL JANE,Drama,English,Phyllis Nagy,"Claude Amadeo, Robbie Brenner, Lee Broda, Michael D'Alto, Kevin McKeon, David M. Wulf","Hayley Schore, Roshan Sethi","Oct 28, 2022  Wide",,$512.8K,2h 2m,Roadside Attractions,"Chicago, 1968. As the city and the nation are poised on the brink of political upheaval, suburban housewife Joy (Elizabeth Banks) leads an ordinary life with her husband and daughter. When Joy's pregnancy leads to a life-threatening heart condition, she must navigate an all-male medical establishment unwilling to terminate her pregnancy in order to save her life. Her journey for a solution leads her to Virginia (Sigourney Weaver), an independent visionary fiercely committed to women's health, and Gwen (Wunmi Mosaku), an activist who dreams of a day when all women will have access to abortion, regardless of their ability to pay. Joy is so inspired by their work, she decides to join forces with them, putting every aspect of her life on the line."
259,RUNNING THE BASES,97%,100+ Verified Ratings,--,RUNNING THE BASES,"Kids & Family, Drama",English,"Marty Roberts, Jimmy Womble",Robert C. Bigelow,"Marty Roberts, Jimmy Womble","Sep 16, 2022  Wide",,$1.5M,2h 7m,UP2U Films,"When a small-town baseball coach gets the offer of a lifetime from a larger 6A High School, he uproots his family and leaves the only home he's ever known. But as a man of faith, he soon faces extreme opposition to his coaching methods from the school superintendent."
260,MURINA,61%,Fewer than 50 Ratings,91%,MURINA,Drama,Croatian,Antoneta Alamat Kusijanovic,"Zdenka Gold, Danijel Pek, Martin Scorsese, Rodrigo Teixeira","Antoneta Alamat Kusijanovic, Frank Graziano","Jul 8, 2022  Limited","Sep 13, 2022",$55.8K,1h 34m,Kino Lorber,"Tensions rise between restless teenager Julija and her oppressive father Ante when an old family friend arrives at their Croatian island home. As Ante attempts to broker a life-changing deal, their tranquil yet isolated existence leaves Julija wanting more from this influential visitor, who provides a taste of liberation over a weekend laid bare to desire and violence."
261,NEPTUNE FROST,71%,Fewer than 50 Ratings,96%,NEPTUNE FROST,"Musical, Sci-Fi",Swahili,"Saul Williams, Anisia Uzeyman","Maria Judice, Ezra Miller, Anisia Uzeyman, Saul Williams",Saul Williams,"Jun 3, 2022  Limited","Jul 5, 2022",$193.9K,1h 45m,Kino Lorber,"In an otherworldly e-waste camp made of recycled computer parts, a subversive hacking collective attempts a takeover of the authoritarian regime exploiting the region's natural resources--and its people. When an intersex runaway (Neptune, played by both Elvis Ngabo and Cheryl Isheja) and an escaped coltan miner (Matalusa, played by Kaya Free) find each other through cosmic forces, their connection sparks glitches within the greater divine circuitry. With hypnotic visuals and original songs composed by musician and co-director Saul Williams, this celestial cyber-musical offers a radically bold vision of power, exploitation, and love."
262,ONLY IN THEATERS,100%,Fewer than 50 Ratings,100%,ONLY IN THEATERS,"Documentary, Biography, History",English,Raphael Sbarge,"Thomas Cassetta, Matt Kubas, Freida Orange, Rick Pratt",,"Nov 18, 2022  Limited",,$10.0K,1h 34m,The Film Collaborative,"ONLY IN THEATERS, a film by actor/director Raphael Sbarge, is an intimate and moving journey taken with the Laemmle family, spanning nearly three years of challenges, losses, and personal triumphs."
263,UTAMA,83%,Fewer than 50 Ratings,95%,UTAMA,Drama,Spanish,Alejandro Loayza Grisi,"Santiago Loayza Grisi, Federico Moreira",Alejandro Loayza Grisi,"Nov 4, 2022  Limited","Jan 3, 2023",$38.9K,1h 27m,Kino Lorber,"In the arid Bolivian highlands, an elderly Quechua couple has been living a tranquil life for years. While he takes their small herd of llamas out to graze, she keeps house and walks for miles with the other local women to fetch precious water. When an uncommonly long drought threatens everything they know, Virginio and Sisa must decide whether to stay and maintain their traditional way of life or admit defeat and move in with family members in the city. Their dilemma is precipitated by the arrival of their grandson Clever, who comes to visit with news. The three of them must face, each in their own way, the effects of a changing environment, the importance of tradition, and the meaning of life itself. This visually jaw-dropping debut feature by photographer-turned-filmmaker Alejandro Loayza Grisi is lensed by award-winning cinematographer Barbara Alvarez (Lucrecia Martel’s The Headless Woman) and won the Grand Jury Prize (World Cinema Dramatic) at the Sundance Film Festival."
264,1982,83%,Fewer than 50 Ratings,95%,1982,"History, Drama",Arabic,Oualid Mouaness,"Oualid Mouaness, Alix Madigan, Georges Schoucair, Myriam Sassine, Christopher Tricarico",Oualid Mouaness,"Jun 10, 2022  Limited",,$43.8K,1h 40m,Tricycle Logic,"""1982"" is a life-affirming coming-of-age tale set at an idyllic school in Lebanon's mountains on the eve of a looming invasion. It unfolds over a single day and follows an 11-year-old boy's relentless quest to profess his love to a girl in his class. As the invasion encroaches on Beirut, it upends the day, threatening the entire country and its cohesion. Within the microcosm of the school, the film draws a harrowing portrait of a society torn between its desire for love and peace and the ideological schisms unraveling its seams. In his debut feature, director Oualid Mouaness delivers an ode to innocence in which he revisits one of the most cataclysmic moments in Lebanon's history through the lens of a child and his vibrant imagination. The film demonstrates the complexities of love and war, and the resilience of the human spirit. ""1982"" stars Mohamad Dalli (in his acting debut) and Lebanese superstar Nadine Labaki (Capernaum, Where Do We Go Now, Caramel) alongside an extraordinary ensemble cast of professional and non-professional actors. ""1982"" is the first film from Lebanon to address the polemic and politically sensitive 1982 Lebanon War."
265,PLEASE BABY PLEASE,60%,Fewer than 50 Ratings,71%,PLEASE BABY PLEASE,"Musical, Drama, Mystery & Thriller",English,Amanda Kramer,"Gül Karakiz, Rob Paris, Mike Witherill","Amanda Kramer, Noel David Taylor","Oct 28, 2022  Limited",,$22.3K,1h 35m,Music Box Films,"Big issues, packaged in flamboyantly witty dialogue, are addressed amidst hyper-stylized decors with a theatrical 1950s feel (think a rather dark, campy twist on West Side Story (1961) as directed by John Waters). How should one be a 'real' man or woman? And, what does the institution of marriage have to do with it? Suze and Arthur are the ideal Lower East Side bohemian couple. He earns a modest living as a clarinetist, she is a stylish housewife, dutifully doing the washing up. One evening, they witness a murder, committed by a rough gang of greasers in leather jackets, on the sidewalk in front of their house. This introduction to the intimidating Young Gents arouses previously unsuspected emotions and feelings of sexuality in both Arthur and Suze."
266,THE AUTOMAT,86%,Fewer than 50 Verified Ratings,98%,THE AUTOMAT,Documentary,English,Lisa Hurwitz,"Lisa Hurwitz, Alec Shuldiner, Russell Greene","Michael Levine, Michael Levine","Feb 18, 2022  Limited",,$257.4K,1h 59m,A Slice of Pie Productions,"Before fast food we had something better. Our grandparents told us stories of gathering around communal tables, sharing their lives, their struggles, and their dreams with strangers at The Automat. In the long awaited Horn & Hardart documentary relive the phenomena of America's original and most beloved restaurant chain. The one hundred year Automat saga serves up never before-seen archival footage and photographs and a cast including celebrity customers, company executives, historians, and members of the Horn & Hardart families."
267,BRAINWASHED: SEX-CAMERA-POWER,--,Fewer than 50 Ratings,74%,BRAINWASHED: SEX-CAMERA-POWER,Documentary,English,Nina Menkes,Nina Menkes,,"Oct 21, 2022  Limited","Dec 6, 2022",$23.0K,1h 47m,Kino Lorber,"Brainwashed is based on director Nina Menkes's cinematic presentation, Sex and Power, the Visual Language of Cinema, that uses film clips by A-list directors from 1896 to the present, to show how the visual grammar of cinema contributes to conditions that create discriminatory hiring practice, pay inequity and a pervasive environment of sexual harassment in the film industry and beyond."
268,GLASS ONION: A KNIVES OUT MYSTERY,93%,500+ Verified Ratings,93%,GLASS ONION: A KNIVES OUT MYSTERY,"Mystery & Thriller, Comedy, Drama",English,Rian Johnson,"Rian Johnson, Ram Bergman",Rian Johnson,"Nov 23, 2022  Wide","Dec 23, 2022",,2h 20m,Netflix,"Benoit Blanc returns to peel back the layers in a new Rian Johnson whodunit. This fresh adventure finds the intrepid detective at a lavish private estate on a Greek island, but how and why he comes to be there is only the first of many puzzles. Blanc soon meets a distinctly disparate group of friends gathering at the invitation of billionaire Miles Bron for their yearly reunion. Among those on the guest list are Miles' former business partner Andi Brand, current Connecticut governor Claire Debella, cutting-edge scientist Lionel Toussaint, fashion designer and former model Birdie Jay and her conscientious assistant Peg, and influencer Duke Cody and his sidekick girlfriend Whiskey. As in all the best murder mysteries, each character harbors their own secrets, lies and motivations. When someone turns up dead, everyone is a suspect."
269,LADY CHATTERLEY'S LOVER,86%,50+ Ratings,85%,LADY CHATTERLEY'S LOVER,"Romance, Drama",English,Laure de Clermont-Tonnerre,"Graham Broadbent, Peter Czernin, Elizabeth Gabler, Laurence Mark",,"Nov 23, 2022  Limited","Dec 2, 2022",,2h 6m,Netflix,"Marrying Sir Clifford Chatterley, Connie's life of wealth and privilege seems set as she takes the title of Lady Chatterley. Yet this idealistic union gradually becomes an incarceration when Clifford returns from the First World War with injuries that have left him unable to walk. When she meets and falls for Oliver Mellors, the gamekeeper on the Chatterley family estate, their secret trysts lead her to a sensual, sexual awakening. But as their affair becomes the subject of local gossip, Connie faces a life-altering decision: follow her heart or return to her husband and endure what Edwardian society expects of her."
270,WHITE NOISE,64%,Fewer than 50 Ratings,67%,WHITE NOISE,"Comedy, Drama, Horror",English,Noah Baumbach,"Noah Baumbach, David Heyman, Uri Singer",Noah Baumbach,"Nov 25, 2022  Limited","Dec 30, 2022",,2h 16m,Netflix,"At once hilarious and horrifying, lyrical and absurd, ordinary and apocalyptic, White Noise dramatizes a contemporary American family's attempts to deal with the mundane conflicts of everyday life while grappling with the universal mysteries of love, death, and the possibility of happiness in an uncertain world."
271,NANNY,60%,Fewer than 50 Ratings,88%,NANNY,"Horror, Mystery & Thriller",English,Nikyatu Jusu,"Nikkia Moulterie, Daniela Taplin Lundberg",Nikyatu Jusu,"Nov 23, 2022  Limited","Dec 16, 2022",,1h 38m,Amazon Studios,"In this psychological horror fable of displacement, Aisha (Anna Diop), a woman who recently emigrated from Senegal, is hired to care for the daughter of an affluent couple (Michelle Monaghan and Morgan Spector) living in New York City. Haunted by the absence of the young son she left behind, Aisha hopes her new job will afford her the chance to bring him to the U.S., but becomes increasingly unsettled by the family's volatile home life. As his arrival approaches, a violent presence begins to invade both her dreams and her reality, threatening the American dream she is painstakingly piecing together."
272,THE SON,75%,Fewer than 50 Ratings,42%,THE SON,Drama,English,Florian Zeller,"Iain Canning, Joanna Laurie, Karl Hartman, Emile Sherman, Christophe Spadone, Florian Zeller","Christopher Hampton, Florian Zeller","Nov 25, 2022  Limited",,,2h 4m,Sony Pictures Classics,"A cautionary tale that follows a family as it struggles to reunite after falling apart. THE SON centers on Peter (Hugh Jackman), whose hectic life with his infant and new partner Beth (Vanessa Kirby) is upended when his ex-wife Kate (Laura Dern) appears at his door to discuss their son Nicholas (Zen McGrath), who is now a teenager. The young man has been missing school for months and is deeply troubled. Peter strives to take care of Nicholas as he would have wanted his own father (Anthony Hopkins) to have taken care of him while juggling his and Beth's new son, and at work an offer of a dream position in Washington. However, by reaching for the past to correct its mistakes, he loses sight of how to hold onto Nicholas in the present."
273,BHEDIYA,89%,50+ Ratings,67%,BHEDIYA,"Comedy, Horror",Hindi,Amar Kaushik,Dinesh Vijan,Niren Bhatt,"Nov 25, 2022  Limited",,,2h 25m,Trident AV Technologies,"Set in the forests of Arunachal, Bhediya is the story of Bhaskar, a man who gets bitten by a wolf and begins to transform into the creature. As Bhaskar and his buddies try to find answers, a bunch of twists, turns and laughs ensue."
274,BATTLE FOR SAIPAN,--,Fewer than 50 Ratings,--,BATTLE FOR SAIPAN,"War, History, Drama, Action",English,Brandon Slagle,Daemon Hillin,Brandon Slagle,"Nov 25, 2022  Limited","Nov 25, 2022",,1h 34m,Saban Films,"Casper Van Dien (Alita: Battle Angel) and Louis Mandylor (Rambo: Last Blood) star in this edge-of-your-seat WWII epic. On July 7th, 1944, a US Army hospital on the remote island of Saipan is overrun by Japanese forces during a relentless attack. Outgunned and surrounded by the enemy, a lone medic (Van Dien) puts it all on the line to lead a band of wounded warriors to safety."
275,THE KING OF LAUGHTER,--,Fewer than 50 Ratings,83%,THE KING OF LAUGHTER,"Biography, Drama",Italian,Mario Martone,,"Mario Martone, Ippolita Di Majo, Mario Martone, Ippolita Di Majo","Nov 25, 2022  Limited","Nov 25, 2022",,2h 13m,Film Movement,"Naples, 1904: Eduardo Scarpetta risked everything by staging a parody of the great Italian poet, Gabriele D'Annunzio. Despite legal troubles and familial strife, Scarpetta fought for his legacy as one of the greats of Italian theater."
276,MOST GUYS ARE LOSERS,--,Fewer than 50 Ratings,--,MOST GUYS ARE LOSERS,"Holiday, Romance, Comedy",English,Eric Ustian,"Lene Amalfi, Anthony Clementi",Eric Ustian,"Nov 25, 2022  Limited","Nov 25, 2022",,1h 31m,Gravitas Ventures,"Sandy's new boyfriend, Bo, meets all the criteria for a good partner (and she knows it)! However, when she brings him home for the holidays, her dad, Mark, thinks he knows better. Bar owner Mark Berzins has seen decades of relationships-gone-wrong, and is determined to poke some holes in this one. A well-intentioned investigation into the new boyfriend leads to awkward misunderstandings, spilled secrets, and heartwarming moments."
277,AN INCONVENIENT LOVE,--,Fewer than 50 Ratings,--,AN INCONVENIENT LOVE,"Romance, Comedy",English,Petersen Vargas,,"Daisy Cayanan, Enrico Santos","Nov 25, 2022  Limited",,,2h 4m,Star Cinema,"Ayef dreams of being an animator and has no time for love. When she meets Manny, they agree to a convenient relationship that will end the month she's set to leave for Singapore."
278,TICH BUTTON,100%,Fewer than 50 Ratings,--,TICH BUTTON,"Romance, Comedy, Adventure",Urdu,Qasim Ali Mureed,"Urwa Hocane, Mohammad Jerjees Seja",,"Nov 25, 2022  Limited",,,2h 25m,ARY Films,"Kaka helps Saqib when he refuses to marry his cousin Shakeela, but the refusal leads to complications and a wealth of lies. Leena from Turkey enters the picture and love is in the air."
279,USERS,--,0 Ratings,45%,USERS,Documentary,English,Natalia Almada,"Josh Penn, Elizabeth Lodge Stepp, Natalia Almada",,"Nov 25, 2022  Limited",,,1h 21m,Icarus Films,"A mother wonders: Will my children grow to love their perfect machines more than they love me? Intimate in scope and epic in scale, director Natalia Almada embarks on a cinematic journey into an invisible realm, where it is taken for granted that technological progress will always inspire social progress, and that ever-smarter machines will make humankind ever better. Constructed from stunning, immaculately rendered images and featuring a score performed by the Kronos Quartet, Users is an immersive journey into the heart of our changing relationship to the natural world."
280,FREEDOM ON FIRE: UKRAINE'S FIGHT FOR FREEDOM,--,Fewer than 50 Ratings,--,FREEDOM ON FIRE: UKRAINE'S FIGHT FOR FREEDOM,,Ukrainian,Evgeny Afineevsky,"Evgeny Afineevsky, Will Znidaric, Galyna Sadomtseva-Nabaranchuk, Shahida Tulaganova, Inna Goncharova, Alex Kashpur",,"Nov 25, 2022  Limited",,,1h 58m,MakeMake Entertainment,"Genre: Documentary, War"
